id,payload
Hurricane Irma,"{""Wiki_Title"": ""Hurricane Irma"", ""sentences"": [""Hurricane Irma was an extremely powerful Cape Verde hurricane that caused widespread destruction across its path in early September 2017."", ""Irma was the first Category 5 hurricane to strike the Leeward Islands on record, followed by Maria two weeks later."", ""At the time, it was considered the most powerful hurricane on record in the open Atlantic region, outside of the Caribbean Sea and Gulf of Mexico, until it was surpassed by Hurricane Dorian two years later."", ""It was also the third-strongest Atlantic hurricane at landfall ever recorded, just behind the 1935 Labor Day Hurricane and Dorian."", ""The ninth named storm, fourth hurricane, second major hurricane, and first Category 5 hurricane of the extremely active 2017 Atlantic hurricane season, Irma caused widespread and catastrophic damage throughout its long lifetime, particularly in the northeastern Caribbean and the Florida Keys."", ""It was also the most intense hurricane to strike the continental United States since Katrina in 2005, the first major hurricane to make landfall in Florida since Wilma in the same year, and the first Category 4 hurricane to strike the state since Charley in 2004."", ""The word Irmageddon was coined soon after the hurricane to describe the damage caused by the hurricane."", ""Irma developed from a tropical wave near the Cape Verde Islands on August 30."", ""Favorable conditions allowed Irma to rapidly intensify into a Category 3 hurricane on the Saffir\u2013Simpson wind scale by late on August 31."", ""On September 4, Irma resumed intensifying, becoming a Category 5 hurricane by early on the next day."", ""Early on September 6, Irma peaked with 1-minute sustained winds of and a minimum pressure of ."", ""Irma was the second-most intense tropical cyclone worldwide in 2017 in terms of barometric pressure, and the strongest worldwide in 2017 in terms of wind speed."", ""Another eyewall replacement cycle caused Irma to weaken back to a Category 4 hurricane, but the storm re-attained Category 5 status before making landfall in Cuba."", ""Although Irma briefly weakened to a Category 2 storm while making landfall on Cuba, the system re-intensified to Category 4 status as it crossed the warm waters of the Straits of Florida, before making landfall on Cudjoe Key on September 10."", ""Irma then weakened to Category 3 status, prior to another landfall in Florida on Marco Island later that day."", ""The storm caused catastrophic damage in Barbuda, Saint Barth\u00e9lemy, Saint Martin, Anguilla, and the Virgin Islands as a Category 5 hurricane."", ""The hurricane caused at least 134 deaths: one in Anguilla; one in Barbados; three in Barbuda; four in the British Virgin Islands; 10 in Cuba; 11 in the French West Indies; one in Haiti; three in Puerto Rico; four on the Dutch side of Sint Maarten; 92 in the contiguous United States, and four in the U.S. Virgin Islands."", ""Hurricane Irma was the top Google searched term in the U.S. and globally in 2017.""], ""video_ids"": {""0fXN4hBjQQg"": ""http://cs.jhu.edu/~amart233/videos/0fXN4hBjQQg.mp4"", ""O4pFdLJmG7M"": ""http://cs.jhu.edu/~amart233/videos/O4pFdLJmG7M.mp4"", ""dA5qYrboTUE"": ""http://cs.jhu.edu/~amart233/videos/dA5qYrboTUE.mp4"", ""PoMUqFw1w48"": ""http://cs.jhu.edu/~amart233/videos/PoMUqFw1w48.mp4"", ""8jfeGPn4WgQ"": ""http://cs.jhu.edu/~amart233/videos/8jfeGPn4WgQ.mp4"", ""mYLoKPaBUD4"": ""http://cs.jhu.edu/~amart233/videos/mYLoKPaBUD4.mp4"", ""I2RXPu2wqXA"": ""http://cs.jhu.edu/~amart233/videos/I2RXPu2wqXA.mp4"", ""jyivlnLVoOA"": ""http://cs.jhu.edu/~amart233/videos/jyivlnLVoOA.mp4""}, ""grounded_claims"": {""Hurricane Irma was an extremely powerful Cape Verde hurricane that caused widespread destruction across its path in early September 2017."": {""claims"": [""Hurricane Irma was a Cape Verde hurricane"", ""Hurricane Irma was extremely powerful"", ""Hurricane Irma caused widespread destruction"", ""Hurricane Irma occurred in early September 2017""], ""grounded"": [true, true, true, true], ""video_ids"": [[""0fXN4hBjQQg""], [""0fXN4hBjQQg"", ""O4pFdLJmG7M"", ""dA5qYrboTUE"", ""PoMUqFw1w48"", ""mYLoKPaBUD4"", ""jyivlnLVoOA""], [""0fXN4hBjQQg"", ""dA5qYrboTUE"", ""PoMUqFw1w48"", ""mYLoKPaBUD4"", ""jyivlnLVoOA""], [""0fXN4hBjQQg"", ""dA5qYrboTUE"", ""PoMUqFw1w48"", ""8jfeGPn4WgQ""]]}, ""Irma was the first Category 5 hurricane to strike the Leeward Islands on record, followed by Maria two weeks later."": {""claims"": [""Irma was a Category 5 hurricane"", ""Irma struck the Leeward Islands""], ""grounded"": [true, true], ""video_ids"": [[""0fXN4hBjQQg"", ""mYLoKPaBUD4""], [""0fXN4hBjQQg"", ""mYLoKPaBUD4""]]}, ""At the time, it was considered the most powerful hurricane on record in the open Atlantic region, outside of the Caribbean Sea and Gulf of Mexico, until it was surpassed by Hurricane Dorian two years later."": {""claims"": [""Irma was the most powerful hurricane on record in the open Atlantic region outside of the Caribbean Sea and Gulf of Mexico""], ""grounded"": [true], ""video_ids"": [[""0fXN4hBjQQg"", ""mYLoKPaBUD4""]]}, ""It was also the third-strongest Atlantic hurricane at landfall ever recorded, just behind the 1935 Labor Day Hurricane and Dorian."": {""claims"": [""Irma occurred in the Atlantic""], ""grounded"": [true], ""video_ids"": [[""0fXN4hBjQQg"", ""dA5qYrboTUE"", ""PoMUqFw1w48"", ""8jfeGPn4WgQ"", ""mYLoKPaBUD4"", ""I2RXPu2wqXA"", ""jyivlnLVoOA""]]}, ""The ninth named storm, fourth hurricane, second major hurricane, and first Category 5 hurricane of the extremely active 2017 Atlantic hurricane season, Irma caused widespread and catastrophic damage throughout its long lifetime, particularly in the northeastern Caribbean and the Florida Keys."": {""claims"": [""Irma caused widespread damage"", ""Irma caused catastrophic damage"", ""Irma's damage was particularly severe in the northeastern Caribbean"", ""Irma occurred during the 2017 Atlantic hurricane season""], ""grounded"": [true, true, true, true], ""video_ids"": [[""0fXN4hBjQQg"", ""dA5qYrboTUE"", ""PoMUqFw1w48"", ""jyivlnLVoOA""], [""0fXN4hBjQQg"", ""PoMUqFw1w48""], [""0fXN4hBjQQg"", ""PoMUqFw1w48""], [""dA5qYrboTUE"", ""8jfeGPn4WgQ""]]}, ""It was also the most intense hurricane to strike the continental United States since Katrina in 2005, the first major hurricane to make landfall in Florida since Wilma in the same year, and the first Category 4 hurricane to strike the state since Charley in 2004."": {""claims"": [""Hurricane Irma struck the continental United States"", ""Hurricane Irma made landfall in Florida"", ""Hurricane Irma was a Category 4 hurricane when it struck Florida""], ""grounded"": [true, true, true], ""video_ids"": [[""0fXN4hBjQQg"", ""8jfeGPn4WgQ"", ""I2RXPu2wqXA"", ""jyivlnLVoOA""], [""0fXN4hBjQQg"", ""8jfeGPn4WgQ"", ""I2RXPu2wqXA"", ""jyivlnLVoOA""], [""0fXN4hBjQQg""]]}, ""The word Irmageddon was coined soon after the hurricane to describe the damage caused by the hurricane."": {""claims"": [""Irma caused damage""], ""grounded"": [true], ""video_ids"": [[""0fXN4hBjQQg"", ""dA5qYrboTUE"", ""PoMUqFw1w48"", ""jyivlnLVoOA""]]}, ""Irma developed from a tropical wave near the Cape Verde Islands on August 30."": {""claims"": [""Irma developed near the Cape Verde Islands""], ""grounded"": [true], ""video_ids"": [[""0fXN4hBjQQg""]]}, ""Favorable conditions allowed Irma to rapidly intensify into a Category 3 hurricane on the Saffir\u2013Simpson wind scale by late on August 31."": {""claims"": [""Irma became a Category 3 hurricane on the Saffir-Simpson wind scale""], ""grounded"": [true], ""video_ids"": [[""0fXN4hBjQQg""]]}, ""On September 4, Irma resumed intensifying, becoming a Category 5 hurricane by early on the next day."": {""claims"": [""Irma resumed intensifying on September 4"", ""Irma became a Category 5 hurricane by early September 5"", ""Irma became a Category 5 hurricane""], ""grounded"": [true, true, true], ""video_ids"": [[""0fXN4hBjQQg""], [""0fXN4hBjQQg""], [""0fXN4hBjQQg"", ""mYLoKPaBUD4""]]}, ""Early on September 6, Irma peaked with 1-minute sustained winds of and a minimum pressure of ."": {""claims"": [""Irma\u2019s intensity peaked on September 6"", ""Irma's highest 1-minute sustained winds was 180 mph"", ""Irma's highest minimum pressure was 914 hPa""], ""grounded"": [true, true, true], ""video_ids"": [[""0fXN4hBjQQg""], [""0fXN4hBjQQg""], [""0fXN4hBjQQg"", ""mYLoKPaBUD4""]]}, ""Irma was the second-most intense tropical cyclone worldwide in 2017 in terms of barometric pressure, and the strongest worldwide in 2017 in terms of wind speed."": {""claims"": [""Irma was the strongest tropical cyclone by wind speed worldwide in 2017"", ""Irma occurred in 2017""], ""grounded"": [true, true], ""video_ids"": [[""0fXN4hBjQQg""], [""dA5qYrboTUE"", ""PoMUqFw1w48"", ""8jfeGPn4WgQ""]]}, ""Another eyewall replacement cycle caused Irma to weaken back to a Category 4 hurricane, but the storm re-attained Category 5 status before making landfall in Cuba."": {""claims"": [""Irma weakened from a Category 5 to Category 4 hurricane"", ""Irma regained Category 5 status before making landfall in Cuba"", ""Irma made landfall in Cuba""], ""grounded"": [true, true, true], ""video_ids"": [[""0fXN4hBjQQg""], [""0fXN4hBjQQg""], [""0fXN4hBjQQg""]]}, ""Although Irma briefly weakened to a Category 2 storm while making landfall on Cuba, the system re-intensified to Category 4 status as it crossed the warm waters of the Straits of Florida, before making landfall on Cudjoe Key on September 10."": {""claims"": [""Irma made landfall on Cuba"", ""Irma cross the Straits of Florida"", ""Irma made landfall on Cudjoe Key"", ""Irma made landfall on Cudjoe Key on September 10"", ""Irma made landfall on Cudjoe Key after crossing the Straits of Florida""], ""grounded"": [true, true, true, true, true], ""video_ids"": [[""0fXN4hBjQQg""], [""0fXN4hBjQQg""], [""0fXN4hBjQQg""], [""0fXN4hBjQQg""], [""0fXN4hBjQQg""]]}, ""Irma then weakened to Category 3 status, prior to another landfall in Florida on Marco Island later that day."": {""claims"": [""Irma made landfall in Florida before landfall at Marco Island"", ""Irma made landfall at Marco Island""], ""grounded"": [true, true], ""video_ids"": [[""0fXN4hBjQQg""], [""0fXN4hBjQQg""]]}, ""The storm caused catastrophic damage in Barbuda, Saint Barth\u00e9lemy, Saint Martin, Anguilla, and the Virgin Islands as a Category 5 hurricane."": {""claims"": [""Irma caused catastrophic damage"", ""Irma caused catastrophic damage in Barbuda"", ""Irma caused catastrophic damage in Saint Barth\u00e9lemy"", ""Irma caused catastrophic damage in Saint Martin"", ""Irma caused catastrophic damage in Anguilla"", ""Irma caused catastrophic damage in the Virgin Islands"", ""Irma was a Category 5 hurricane"", ""Irma hit Barbuda as a Category 5 hurricane"", ""Irma hit Saint Barth\u00e9lemy as a Category 5 hurricane"", ""Irma hit Saint Martin as a Category 5 hurricane"", ""Irma hit Anguilla as a Category 5 hurricane"", ""Irma hit Virgin Islands as a Category 5 hurricane""], ""grounded"": [true, true, true, true, true, true, true, true, true, true, true, true], ""video_ids"": [[""0fXN4hBjQQg"", ""PoMUqFw1w48""], [""0fXN4hBjQQg""], [""0fXN4hBjQQg""], [""0fXN4hBjQQg"", ""PoMUqFw1w48""], [""0fXN4hBjQQg""], [""0fXN4hBjQQg""], [""0fXN4hBjQQg""], [""0fXN4hBjQQg"", ""mYLoKPaBUD4""], [""0fXN4hBjQQg"", ""mYLoKPaBUD4""], [""0fXN4hBjQQg"", ""mYLoKPaBUD4""], [""0fXN4hBjQQg"", ""mYLoKPaBUD4""], [""0fXN4hBjQQg"", ""mYLoKPaBUD4""]]}, ""The hurricane caused at least 134 deaths: one in Anguilla; one in Barbados; three in Barbuda; four in the British Virgin Islands; 10 in Cuba; 11 in the French West Indies; one in Haiti; three in Puerto Rico; four on the Dutch side of Sint Maarten; 92 in the contiguous United States, and four in the U.S. Virgin Islands."": {""claims"": [""Irma made landfall in Anguilla"", ""Irma made landfall in Barbados"", ""Irma made landfall in Barbuda"", ""Irma made landfall in the British Virgin Islands"", ""Irma made landfall in Cuba"", ""Irma made landfall in French West Indies"", ""Irma made landfall in Haiti"", ""Irma made landfall in Puerto Rico"", ""Irma made landfall on the Dutch side of Sint Maarten"", ""Irma made landfall in the contiguous United States"", ""Irma made landfall in the U.S. Virgin Islands""], ""grounded"": [true, true, true, true, true, true, true, true, true, true, true], ""video_ids"": [[""0fXN4hBjQQg"", ""mYLoKPaBUD4""], [""0fXN4hBjQQg"", ""mYLoKPaBUD4""], [""0fXN4hBjQQg"", ""mYLoKPaBUD4""], [""0fXN4hBjQQg"", ""mYLoKPaBUD4""], [""0fXN4hBjQQg"", ""mYLoKPaBUD4""], [""0fXN4hBjQQg"", ""mYLoKPaBUD4""], [""0fXN4hBjQQg"", ""mYLoKPaBUD4""], [""0fXN4hBjQQg"", ""mYLoKPaBUD4""], [""0fXN4hBjQQg"", ""dA5qYrboTUE"", ""PoMUqFw1w48"", ""mYLoKPaBUD4""], [""0fXN4hBjQQg"", ""8jfeGPn4WgQ"", ""I2RXPu2wqXA"", ""jyivlnLVoOA""], [""0fXN4hBjQQg"", ""mYLoKPaBUD4""]]}, ""Hurricane Irma was the top Google searched term in the U.S. and globally in 2017."": {""claims"": [""Hurricane Irma occurred in 2017""], ""grounded"": [true], ""video_ids"": [[""dA5qYrboTUE"", ""PoMUqFw1w48"", ""8jfeGPn4WgQ""]]}}}"
2018 Anchorage earthquake,"{""Wiki_Title"": ""2018 Anchorage earthquake"", ""sentences"": [""On November 30, 2018, at 8:29 a.m. AKST (17:29 UTC), a magnitude 7.1 earthquake hit Anchorage in South Central Alaska."", ""The earthquake's epicenter was near Point Mackenzie, about north of Anchorage, and occurred at a depth of ."", ""It was followed six minutes later by a magnitude 5.7 aftershock centered north-northwest of the municipality."", ""The earthquake could be felt as far away as Fairbanks."", ""The National Tsunami Warning Center\u2014itself located inside the quake zone, in Palmer, Alaska, northeast of Anchorage\u2014issued tsunami warnings for nearby coastal areas, including Cook Inlet and the Kenai Peninsula, but they were lifted shortly after.""], ""video_ids"": {""2obcml1lb3E"": ""http://cs.jhu.edu/~amart233/videos/2obcml1lb3E.mp4"", ""vUbGfD5c6JU"": ""http://cs.jhu.edu/~amart233/videos/vUbGfD5c6JU.mp4"", ""WXTrueWndD8"": ""http://cs.jhu.edu/~amart233/videos/WXTrueWndD8.mp4"", ""1lMX9eZMEIo"": ""http://cs.jhu.edu/~amart233/videos/1lMX9eZMEIo.mp4"", ""rX-NofLZfNA"": ""http://cs.jhu.edu/~amart233/videos/rX-NofLZfNA.mp4"", ""faK6magPCJU"": ""http://cs.jhu.edu/~amart233/videos/faK6magPCJU.mp4"", ""DSkG2gEz-6Y"": ""http://cs.jhu.edu/~amart233/videos/DSkG2gEz-6Y.mp4"", ""ot-YkX-f5Ew"": ""http://cs.jhu.edu/~amart233/videos/ot-YkX-f5Ew.mp4"", ""0vKs4-EZ_D0"": ""http://cs.jhu.edu/~amart233/videos/0vKs4-EZ_D0.mp4"", ""6SReDtBCT-Y"": ""http://cs.jhu.edu/~amart233/videos/6SReDtBCT-Y.mp4""}, ""grounded_claims"": {""On November 30, 2018, at 8:29 a.m. AKST (17:29 UTC), a magnitude 7.1 earthquake hit Anchorage in South Central Alaska."": {""claims"": [""The earthquake occurred"", ""The earthquake occurred on November 30 2018"", ""The earthquake occurred at 8:29 a.m. AKST"", ""The earthquake hit Anchorage"", ""The earthquake hit South Central Alaska"", ""The earthquake had a magnitude of 7.1""], ""grounded"": [true, true, true, true, true, true], ""video_ids"": [[""2obcml1lb3E"", ""vUbGfD5c6JU"", ""WXTrueWndD8"", ""1lMX9eZMEIo"", ""rX-NofLZfNA"", ""faK6magPCJU"", ""DSkG2gEz-6Y"", ""ot-YkX-f5Ew"", ""0vKs4-EZ_D0"", ""6SReDtBCT-Y""], [""faK6magPCJU""], [""faK6magPCJU"", ""6SReDtBCT-Y""], [""vUbGfD5c6JU"", ""WXTrueWndD8"", ""1lMX9eZMEIo"", ""rX-NofLZfNA"", ""faK6magPCJU"", ""DSkG2gEz-6Y"", ""ot-YkX-f5Ew"", ""6SReDtBCT-Y""], [""vUbGfD5c6JU"", ""WXTrueWndD8"", ""1lMX9eZMEIo"", ""rX-NofLZfNA"", ""faK6magPCJU"", ""DSkG2gEz-6Y"", ""ot-YkX-f5Ew"", ""0vKs4-EZ_D0"", ""6SReDtBCT-Y""], [""vUbGfD5c6JU"", ""WXTrueWndD8"", ""1lMX9eZMEIo"", ""rX-NofLZfNA"", ""faK6magPCJU"", ""ot-YkX-f5Ew"", ""6SReDtBCT-Y""]]}, ""The earthquake's epicenter was near Point Mackenzie, about north of Anchorage, and occurred at a depth of ."": {""claims"": [""The earthquake\u2019s epicenter was 10 miles north of Anchorage"", ""The earthquake occurred at a depth of 29 miles""], ""grounded"": [true, true], ""video_ids"": [[""faK6magPCJU"", ""DSkG2gEz-6Y""], [""faK6magPCJU""]]}, ""It was followed six minutes later by a magnitude 5.7 aftershock centered north-northwest of the municipality."": {""claims"": [""An aftershock occurred"", ""The aftershock had a magnitude of 5.7""], ""grounded"": [true, true], ""video_ids"": [[""1lMX9eZMEIo"", ""rX-NofLZfNA"", ""faK6magPCJU"", ""DSkG2gEz-6Y"", ""ot-YkX-f5Ew"", ""6SReDtBCT-Y""], [""1lMX9eZMEIo"", ""6SReDtBCT-Y""]]}, ""The earthquake could be felt as far away as Fairbanks."": {""claims"": [""The earthquake occurred""], ""grounded"": [true], ""video_ids"": [[""2obcml1lb3E"", ""vUbGfD5c6JU"", ""WXTrueWndD8"", ""1lMX9eZMEIo"", ""rX-NofLZfNA"", ""faK6magPCJU"", ""DSkG2gEz-6Y"", ""ot-YkX-f5Ew"", ""0vKs4-EZ_D0"", ""6SReDtBCT-Y""]]}, ""The National Tsunami Warning Center\u2014itself located inside the quake zone, in Palmer, Alaska, northeast of Anchorage\u2014issued tsunami warnings for nearby coastal areas, including Cook Inlet and the Kenai Peninsula, but they were lifted shortly after."": {""claims"": [""The National Tsunami Warning Center issued tsunami warnings"", ""Tsunami warnings were issued for nearby coastal areas"", ""Tsunami warnings were issued for Cook Inlet"", ""Tsunami warnings were lifted shortly after being issued"", ""Tsunami warnings for nearby coastal areas were lifted"", ""Tsunami warnings for Cook Inlet were lifted""], ""grounded"": [true, true, true, true, true, true], ""video_ids"": [[""1lMX9eZMEIo"", ""6SReDtBCT-Y""], [""1lMX9eZMEIo"", ""DSkG2gEz-6Y"", ""6SReDtBCT-Y""], [""6SReDtBCT-Y""], [""1lMX9eZMEIo"", ""6SReDtBCT-Y""], [""1lMX9eZMEIo"", ""6SReDtBCT-Y""], [""6SReDtBCT-Y""]]}}}"
Pokémon Go,"{""Wiki_Title"": ""Pok\u00e9mon Go"", ""sentences"": [""Pok\u00e9mon Go (stylized as Pok\u00e9mon GO) is a 2016 augmented reality (AR) mobile game, part of the Pok\u00e9mon franchise, developed and published by Niantic in collaboration with Nintendo and The Pok\u00e9mon Company for iOS and Android devices."", ""It uses mobile devices with GPS to locate, capture, train, and battle virtual Pok\u00e9mon, which appear as if they are in the player's real-world location."", ""The game launched with around 150 species of Pok\u00e9mon, which had increased to around 700 by 2021."", ""Pok\u00e9mon Go was released to mixed reviews; critics praised the concept but criticized technical problems."", ""It was one of the most used and profitable mobile apps in 2016, having been downloaded more than 500 million times worldwide by the end of the year."", ""It is credited with popularizing location-based and AR technology, promoting physical activity, and helping local businesses grow due to escalated foot traffic.""], ""video_ids"": {""759536072615493633"": ""http://cs.jhu.edu/~amart233/videos/759536072615493633.mp4"", ""758445799852212224"": ""http://cs.jhu.edu/~amart233/videos/758445799852212224.mp4"", ""759054079666425857"": ""http://cs.jhu.edu/~amart233/videos/759054079666425857.mp4"", ""758334886633730048"": ""http://cs.jhu.edu/~amart233/videos/758334886633730048.mp4"", ""759242021626404864"": ""http://cs.jhu.edu/~amart233/videos/759242021626404864.mp4"", ""758724178342182912"": ""http://cs.jhu.edu/~amart233/videos/758724178342182912.mp4"", ""759201035038621696"": ""http://cs.jhu.edu/~amart233/videos/759201035038621696.mp4"", ""759156058447290368"": ""http://cs.jhu.edu/~amart233/videos/759156058447290368.mp4""}, ""grounded_claims"": {""Pok\u00e9mon Go (stylized as Pok\u00e9mon GO) is a 2016 augmented reality (AR) mobile game, part of the Pok\u00e9mon franchise, developed and published by Niantic in collaboration with Nintendo and The Pok\u00e9mon Company for iOS and Android devices."": {""claims"": [""Pok\u00e9mon Go is a mobile game"", ""Pok\u00e9mon Go is an augmented reality (AR) game"", ""Pok\u00e9mon Go is part of the Pok\u00e9mon franchise"", ""Pok\u00e9mon Go was developed for iOS devices"", ""Pok\u00e9mon Go was published for iOS devices"", ""Pok\u00e9mon Go was developed for Android devices"", ""Pok\u00e9mon Go was published for Android devices""], ""grounded"": [true, true, true, true, true, true, true], ""video_ids"": [[""759536072615493633"", ""758445799852212224"", ""759054079666425857"", ""758334886633730048"", ""759242021626404864"", ""758724178342182912"", ""759156058447290368""], [""758445799852212224""], [""759054079666425857""], [""759536072615493633"", ""759054079666425857"", ""758334886633730048"", ""758724178342182912"", ""759156058447290368""], [""759536072615493633"", ""759054079666425857"", ""758334886633730048"", ""758724178342182912"", ""759156058447290368""], [""758334886633730048"", ""758724178342182912"", ""759156058447290368""], [""758334886633730048"", ""758724178342182912"", ""759156058447290368""]]}, ""It uses mobile devices with GPS to locate, capture, train, and battle virtual Pok\u00e9mon, which appear as if they are in the player's real-world location."": {""claims"": [""Pok\u00e9mon Go works on mobile devices"", ""Pok\u00e9mon Go uses GPS"", ""Pok\u00e9mon Go involves locating virtual Pok\u00e9mon"", ""Pok\u00e9mon Go involves capturing virtual Pok\u00e9mon""], ""grounded"": [true, true, true, true], ""video_ids"": [[""759536072615493633"", ""758445799852212224"", ""759054079666425857"", ""758334886633730048"", ""759242021626404864"", ""758724178342182912"", ""759156058447290368""], [""759536072615493633"", ""759054079666425857"", ""758334886633730048"", ""758724178342182912""], [""759156058447290368""], [""759536072615493633"", ""759054079666425857"", ""759156058447290368""]]}, ""The game launched with around 150 species of Pok\u00e9mon, which had increased to around 700 by 2021."": {""claims"": [""Pok\u00e9mon Go launched"", ""Pok\u00e9mon Go launched with around 150 species of Pok\u00e9mon""], ""grounded"": [true, true], ""video_ids"": [[""759536072615493633"", ""758445799852212224"", ""759054079666425857"", ""758334886633730048"", ""759242021626404864"", ""758724178342182912"", ""759156058447290368""], [""759054079666425857""]]}, ""Pok\u00e9mon Go was released to mixed reviews; critics praised the concept but criticized technical problems."": {""claims"": [""Pok\u00e9mon Go was released""], ""grounded"": [true], ""video_ids"": [[""759536072615493633"", ""758445799852212224"", ""759054079666425857"", ""758334886633730048"", ""759242021626404864"", ""758724178342182912"", ""759156058447290368""]]}, ""It was one of the most used and profitable mobile apps in 2016, having been downloaded more than 500 million times worldwide by the end of the year."": {""claims"": [""Pok\u00e9mon Go is a mobile app""], ""grounded"": [true], ""video_ids"": [[""759536072615493633"", ""758445799852212224"", ""759054079666425857"", ""758334886633730048"", ""759242021626404864"", ""758724178342182912"", ""759156058447290368""]]}, ""It is credited with popularizing location-based and AR technology, promoting physical activity, and helping local businesses grow due to escalated foot traffic."": {""claims"": [""Pok\u00e9mon Go is credited with popularizing location-based technology"", ""Pok\u00e9mon Go is credited with promoting physical activity"", ""Pok\u00e9mon Go is credited with escalating foot traffic""], ""grounded"": [true, true, true], ""video_ids"": [[""758724178342182912""], [""758724178342182912"", ""759156058447290368""], [""759242021626404864"", ""758724178342182912"", ""759201035038621696"", ""759156058447290368""]]}}}"
