id,payload
Notre-Dame fire,"{""Wiki_Title"": ""Notre-Dame fire"", ""sentences"": [""On 15 April 2019, just before 18:20 CEST, a structural fire broke out in the roof space of Notre-Dame de Paris, a medieval Catholic cathedral in Paris, France."", ""By the time the fire was extinguished, the cathedral's wooden spire (fl\u00e8che) had collapsed, most of the wooden roof had been destroyed, and the cathedral's upper walls were severely damaged."", ""Extensive damage to the interior was prevented by the vaulted stone ceiling, which largely contained the burning roof as it collapsed."", ""Many works of art and religious relics were moved to safety, but others suffered smoke damage, and some of the exterior art was damaged or destroyed."", ""The cathedral's altar, two pipe organs, and three 13th-century rose windows suffered little or no damage."", ""Three emergency workers were injured."", ""The fire contaminated the site and nearby areas of Paris with toxic dust and lead."", ""On 17 April, French president Emmanuel Macron set a five-year deadline to restore the cathedral.""], ""video_ids"": {""1117864206475218944"": ""http://cs.jhu.edu/~amart233/videos/1117864206475218944.mp4"", ""1117843269101268992"": ""http://cs.jhu.edu/~amart233/videos/1117843269101268992.mp4"", ""1117835607928184832"": ""http://cs.jhu.edu/~amart233/videos/1117835607928184832.mp4"", ""3QtYT_Ac9Kc"": ""http://cs.jhu.edu/~amart233/videos/3QtYT_Ac9Kc.mp4"", ""34_5a2Y0aog"": ""http://cs.jhu.edu/~amart233/videos/34_5a2Y0aog.mp4"", ""Pq0iGvSTcCY"": ""http://cs.jhu.edu/~amart233/videos/Pq0iGvSTcCY.mp4"", ""W7v5Q7BQzTk"": ""http://cs.jhu.edu/~amart233/videos/W7v5Q7BQzTk.mp4"", ""2Zpw_KAEhDY"": ""http://cs.jhu.edu/~amart233/videos/2Zpw_KAEhDY.mp4"", ""o6EHebVgSUE"": ""http://cs.jhu.edu/~amart233/videos/o6EHebVgSUE.mp4"", ""TUxXp0UKfUI"": ""http://cs.jhu.edu/~amart233/videos/TUxXp0UKfUI.mp4""}, ""grounded_claims"": {""On 15 April 2019, just before 18:20 CEST, a structural fire broke out in the roof space of Notre-Dame de Paris, a medieval Catholic cathedral in Paris, France."": {""claims"": [""A structural fire broke out"", ""The fire broke out in the roof space"", ""Notre-Dame de Paris is a medieval Catholic cathedral"", ""Notre-Dame de Paris is located in Paris, France""], ""grounded"": [true, true, true, true], ""video_ids"": [[""1117864206475218944"", ""1117843269101268992"", ""1117835607928184832"", ""3QtYT_Ac9Kc"", ""34_5a2Y0aog"", ""Pq0iGvSTcCY"", ""W7v5Q7BQzTk"", ""2Zpw_KAEhDY"", ""o6EHebVgSUE""], [""1117864206475218944"", ""1117843269101268992"", ""1117835607928184832"", ""3QtYT_Ac9Kc"", ""34_5a2Y0aog"", ""Pq0iGvSTcCY"", ""W7v5Q7BQzTk"", ""2Zpw_KAEhDY""], [""1117864206475218944"", ""1117835607928184832"", ""3QtYT_Ac9Kc"", ""34_5a2Y0aog"", ""Pq0iGvSTcCY"", ""W7v5Q7BQzTk"", ""2Zpw_KAEhDY"", ""o6EHebVgSUE"", ""TUxXp0UKfUI""], [""1117843269101268992"", ""1117835607928184832"", ""3QtYT_Ac9Kc"", ""34_5a2Y0aog"", ""W7v5Q7BQzTk"", ""2Zpw_KAEhDY"", ""o6EHebVgSUE"", ""TUxXp0UKfUI""]]}, ""By the time the fire was extinguished, the cathedral's wooden spire (fl\u00e8che) had collapsed, most of the wooden roof had been destroyed, and the cathedral's upper walls were severely damaged."": {""claims"": [""The fire was extinguished"", ""The cathedral's wooden spire (fl\u00e8che) collapsed"", ""Most of the cathedral's wooden roof was destroyed"", ""The cathedral's upper walls were severely damaged""], ""grounded"": [true, true, true, true], ""video_ids"": [[""W7v5Q7BQzTk"", ""2Zpw_KAEhDY"", ""TUxXp0UKfUI""], [""3QtYT_Ac9Kc"", ""34_5a2Y0aog"", ""Pq0iGvSTcCY"", ""W7v5Q7BQzTk"", ""2Zpw_KAEhDY"", ""o6EHebVgSUE"", ""TUxXp0UKfUI""], [""3QtYT_Ac9Kc"", ""34_5a2Y0aog"", ""Pq0iGvSTcCY"", ""W7v5Q7BQzTk"", ""2Zpw_KAEhDY"", ""TUxXp0UKfUI""], [""3QtYT_Ac9Kc"", ""34_5a2Y0aog"", ""Pq0iGvSTcCY"", ""W7v5Q7BQzTk"", ""2Zpw_KAEhDY"", ""TUxXp0UKfUI""]]}, ""Extensive damage to the interior was prevented by the vaulted stone ceiling, which largely contained the burning roof as it collapsed."": {""claims"": [""Extensive damage to the cathedral's interior was prevented"", ""The vaulted stone ceiling largely contained the burning roof"", ""The cathedral's burning roof collapsed"", ""The vaulted stone ceiling prevented extensive damage to the cathedral\u2019s interior ""], ""grounded"": [true, true, true, true], ""video_ids"": [[""W7v5Q7BQzTk"", ""2Zpw_KAEhDY"", ""TUxXp0UKfUI""], [""W7v5Q7BQzTk"", ""2Zpw_KAEhDY"", ""TUxXp0UKfUI""], [""3QtYT_Ac9Kc"", ""34_5a2Y0aog"", ""Pq0iGvSTcCY"", ""W7v5Q7BQzTk"", ""2Zpw_KAEhDY"", ""TUxXp0UKfUI""], [""W7v5Q7BQzTk"", ""2Zpw_KAEhDY"", ""TUxXp0UKfUI""]]}, ""Many works of art and religious relics were moved to safety, but others suffered smoke damage, and some of the exterior art was damaged or destroyed."": {""claims"": [""Some works of art suffered smoke damage"", ""Some religious relics suffered smoke damage"", ""Some exterior art was damaged"", ""Some exterior art was destroyed""], ""grounded"": [true, true, true, true], ""video_ids"": [[""W7v5Q7BQzTk"", ""2Zpw_KAEhDY"", ""TUxXp0UKfUI""], [""W7v5Q7BQzTk"", ""2Zpw_KAEhDY"", ""TUxXp0UKfUI""], [""1117864206475218944"", ""3QtYT_Ac9Kc"", ""34_5a2Y0aog"", ""Pq0iGvSTcCY"", ""2Zpw_KAEhDY"", ""o6EHebVgSUE""], [""1117864206475218944"", ""3QtYT_Ac9Kc"", ""34_5a2Y0aog"", ""Pq0iGvSTcCY"", ""2Zpw_KAEhDY"", ""o6EHebVgSUE""]]}, ""The cathedral's altar, two pipe organs, and three 13th-century rose windows suffered little or no damage."": {""claims"": [""The cathedral's altar suffered little or no damage"", ""The cathedral's three 13th-century rose windows suffered little or no damage""], ""grounded"": [true, true], ""video_ids"": [[""W7v5Q7BQzTk"", ""2Zpw_KAEhDY"", ""TUxXp0UKfUI""], [""TUxXp0UKfUI""]]}, ""Three emergency workers were injured."": {""claims"": [""Emergency workers were present during the fire""], ""grounded"": [true], ""video_ids"": [[""1117835607928184832"", ""3QtYT_Ac9Kc"", ""34_5a2Y0aog"", ""Pq0iGvSTcCY"", ""W7v5Q7BQzTk"", ""2Zpw_KAEhDY"", ""o6EHebVgSUE""]]}, ""The fire contaminated the site and nearby areas of Paris with toxic dust and lead."": {""claims"": [""The fire contaminated the site"", ""The fire contaminated nearby areas of Paris"", ""The contamination included toxic dust"", ""The cathedral is located in Paris""], ""grounded"": [true, true, true, true], ""video_ids"": [[""1117864206475218944"", ""1117843269101268992"", ""1117835607928184832"", ""3QtYT_Ac9Kc"", ""34_5a2Y0aog"", ""W7v5Q7BQzTk"", ""2Zpw_KAEhDY"", ""TUxXp0UKfUI""], [""1117843269101268992"", ""1117835607928184832"", ""3QtYT_Ac9Kc"", ""34_5a2Y0aog""], [""1117864206475218944"", ""1117843269101268992"", ""1117835607928184832"", ""3QtYT_Ac9Kc"", ""34_5a2Y0aog"", ""2Zpw_KAEhDY""], [""1117835607928184832"", ""3QtYT_Ac9Kc"", ""34_5a2Y0aog"", ""Pq0iGvSTcCY"", ""W7v5Q7BQzTk"", ""2Zpw_KAEhDY"", ""o6EHebVgSUE"", ""TUxXp0UKfUI""]]}, ""On 17 April, French president Emmanuel Macron set a five-year deadline to restore the cathedral."": {""claims"": [""The deadline was set by Emmanuel Macron"", ""The deadline is for the restoration of the cathedral"", ""Emmanuel Macron is the the French president at the time of the deadline setting""], ""grounded"": [true, true, true], ""video_ids"": [[""2Zpw_KAEhDY""], [""2Zpw_KAEhDY""], [""2Zpw_KAEhDY""]]}}}"
2022 United States Senate election in Georgia,"{""Wiki_Title"": ""2022 United States Senate election in Georgia"", ""sentences"": [""The 2022 United States Senate election in Georgia was held on November 8, 2022, to elect a member of the U.S. Senate to represent the state of Georgia."", ""Incumbent Democratic senator Raphael Warnock won his first full term in office, defeating Republican former football player Herschel Walker."", ""Under Georgia's two-round system, Warnock was re-elected in a runoff election on December 6 after neither candidate received over 50% of the vote on November 8."", ""Warnock's win was the only statewide victory for Democrats in Georgia in 2022, as Republicans swept all other races."", ""Warnock, who won a shortened term to the seat in a 2020\u201321 special election, was nominated in the May 24 primary for a full term with minimal opposition."", ""It was the first U.S. Senate election in Georgia history and among five nationwide since the passage of the Seventeenth Amendment in 1913 in which both major party nominees were Black."", ""This was the fifth runoff in Georgia since they were introduced in 1964."", ""In the November 8 election, Warnock received 49.4% of the vote and Walker received 48.5%, triggering the December 6 runoff."", ""Warnock defeated Walker by a 2.8% margin in the runoff and became the first African-American from Georgia elected to a full term in the U.S. Senate."", ""Warnock's victory also secured an outright majority for Senate Democrats for the first time since 2015, with a net gain of one seat in the 2022 midterms."", ""It was the third-closest Senate election of the 2022 midterms after Nevada and Wisconsin."", ""This is the first time since 1990 that a Democratic senator from Georgia won re-election and the first time since 1974 that a Democrat won re-election to the Class 3 seat.""], ""video_ids"": {""1590400935393648641"": ""http://cs.jhu.edu/~amart233/videos/1590400935393648641.mp4"", ""1590320914960302081"": ""http://cs.jhu.edu/~amart233/videos/1590320914960302081.mp4"", ""1590398912724017152"": ""http://cs.jhu.edu/~amart233/videos/1590398912724017152.mp4"", ""FELPIDFfRLg"": ""http://cs.jhu.edu/~amart233/videos/FELPIDFfRLg.mp4"", ""MoNlUMFqUFY"": ""http://cs.jhu.edu/~amart233/videos/MoNlUMFqUFY.mp4"", ""uWFRDGc7TUM"": ""http://cs.jhu.edu/~amart233/videos/uWFRDGc7TUM.mp4"", ""KOnFkleRZlM"": ""http://cs.jhu.edu/~amart233/videos/KOnFkleRZlM.mp4"", ""3B7VZCHKUWE"": ""http://cs.jhu.edu/~amart233/videos/3B7VZCHKUWE.mp4""}, ""grounded_claims"": {""The 2022 United States Senate election in Georgia was held on November 8, 2022, to elect a member of the U.S. Senate to represent the state of Georgia."": {""claims"": [""The election was held on November 8, 2022"", ""The election was for a U.S. Senate position"", ""The election was to represent Georgia"", ""The election took place""], ""grounded"": [true, true, true, true], ""video_ids"": [[""1590400935393648641"", ""1590320914960302081"", ""1590398912724017152"", ""KOnFkleRZlM""], [""1590400935393648641"", ""1590320914960302081"", ""1590398912724017152"", ""FELPIDFfRLg"", ""MoNlUMFqUFY"", ""uWFRDGc7TUM"", ""KOnFkleRZlM"", ""3B7VZCHKUWE""], [""1590400935393648641"", ""1590320914960302081"", ""1590398912724017152"", ""FELPIDFfRLg"", ""MoNlUMFqUFY"", ""uWFRDGc7TUM"", ""KOnFkleRZlM"", ""3B7VZCHKUWE""], [""1590400935393648641"", ""1590320914960302081"", ""1590398912724017152"", ""FELPIDFfRLg"", ""MoNlUMFqUFY"", ""uWFRDGc7TUM"", ""KOnFkleRZlM"", ""3B7VZCHKUWE""]]}, ""Incumbent Democratic senator Raphael Warnock won his first full term in office, defeating Republican former football player Herschel Walker."": {""claims"": [""Raphael Warnock is a Democrat"", ""Raphael Warnock was the incumbent senator"", ""Raphael Warnock won his first full term in office"", ""Raphael Warnock's previous term was not a full term"", ""Herschel Walker is a Republican"", ""Herschel Walker is a former football player""], ""grounded"": [true, true, true, true, true, true], ""video_ids"": [[""1590400935393648641"", ""1590320914960302081"", ""1590398912724017152"", ""FELPIDFfRLg"", ""MoNlUMFqUFY"", ""uWFRDGc7TUM"", ""KOnFkleRZlM"", ""3B7VZCHKUWE""], [""1590400935393648641"", ""1590320914960302081"", ""1590398912724017152"", ""FELPIDFfRLg"", ""MoNlUMFqUFY"", ""uWFRDGc7TUM"", ""KOnFkleRZlM"", ""3B7VZCHKUWE""], [""MoNlUMFqUFY""], [""3B7VZCHKUWE""], [""1590400935393648641"", ""1590320914960302081"", ""1590398912724017152"", ""FELPIDFfRLg"", ""MoNlUMFqUFY"", ""uWFRDGc7TUM"", ""KOnFkleRZlM"", ""3B7VZCHKUWE""], [""FELPIDFfRLg""]]}, ""Under Georgia's two-round system, Warnock was re-elected in a runoff election on December 6 after neither candidate received over 50% of the vote on November 8."": {""claims"": [""Georgia has a two-round election system"", ""The runoff election is part of the two-round election system in Georgia"", ""A run off election occurs when no candidate receives 50% of the vote"", ""Neither candidate received more than 50% of the vote in the first election"", ""The runoff election took place on December 6"", ""Warnock won the runoff election"", ""Warnock was the incumbent candidate"", ""The first election took place on November 8""], ""grounded"": [true, true, true, true, true, true, true, true], ""video_ids"": [[""1590400935393648641"", ""1590320914960302081"", ""1590398912724017152"", ""FELPIDFfRLg"", ""MoNlUMFqUFY"", ""uWFRDGc7TUM"", ""KOnFkleRZlM"", ""3B7VZCHKUWE""], [""1590400935393648641"", ""1590398912724017152"", ""FELPIDFfRLg"", ""MoNlUMFqUFY"", ""uWFRDGc7TUM"", ""KOnFkleRZlM"", ""3B7VZCHKUWE""], [""1590400935393648641"", ""1590320914960302081"", ""1590398912724017152"", ""3B7VZCHKUWE""], [""1590400935393648641"", ""1590320914960302081"", ""1590398912724017152"", ""MoNlUMFqUFY"", ""KOnFkleRZlM""], [""1590398912724017152"", ""KOnFkleRZlM"", ""3B7VZCHKUWE""], [""MoNlUMFqUFY""], [""1590400935393648641"", ""1590320914960302081"", ""1590398912724017152"", ""FELPIDFfRLg"", ""MoNlUMFqUFY"", ""uWFRDGc7TUM"", ""KOnFkleRZlM"", ""3B7VZCHKUWE""], [""1590400935393648641"", ""1590320914960302081"", ""1590398912724017152""]]}, ""Warnock's win was the only statewide victory for Democrats in Georgia in 2022, as Republicans swept all other races."": {""claims"": [""Warnock won the election"", ""Warnock is a Democrat"", ""Warnock's win was a statewide victory""], ""grounded"": [true, true, true], ""video_ids"": [[""MoNlUMFqUFY""], [""1590400935393648641"", ""1590320914960302081"", ""1590398912724017152"", ""FELPIDFfRLg"", ""MoNlUMFqUFY"", ""uWFRDGc7TUM"", ""KOnFkleRZlM"", ""3B7VZCHKUWE""], [""MoNlUMFqUFY""]]}, ""Warnock, who won a shortened term to the seat in a 2020\u201321 special election, was nominated in the May 24 primary for a full term with minimal opposition."": {""claims"": [""Warnock won a shortened term to the seat"", ""The special election took place in 2020-21""], ""grounded"": [true, true], ""video_ids"": [[""3B7VZCHKUWE""], [""3B7VZCHKUWE""]]}, ""It was the first U.S. Senate election in Georgia history and among five nationwide since the passage of the Seventeenth Amendment in 1913 in which both major party nominees were Black."": {""claims"": [""There was a U.S. Senate election in Georgia""], ""grounded"": [true], ""video_ids"": [[""1590400935393648641"", ""1590320914960302081"", ""1590398912724017152"", ""FELPIDFfRLg"", ""MoNlUMFqUFY"", ""uWFRDGc7TUM"", ""KOnFkleRZlM"", ""3B7VZCHKUWE""]]}, ""This was the fifth runoff in Georgia since they were introduced in 1964."": {""claims"": [""A runoff occurred in this election""], ""grounded"": [true], ""video_ids"": [[""1590400935393648641"", ""1590398912724017152"", ""FELPIDFfRLg"", ""MoNlUMFqUFY"", ""uWFRDGc7TUM"", ""KOnFkleRZlM""]]}, ""In the November 8 election, Warnock received 49.4% of the vote and Walker received 48.5%, triggering the December 6 runoff."": {""claims"": [""The election took place on November 8"", ""Warnock received 49.4% of the votes in the November 8 election"", ""Walker received 48.5% of the votes in the November 8 election"", ""The results of the November 8 election triggered a runoff election"", ""The runoff election took place on December 6""], ""grounded"": [true, true, true, true, true], ""video_ids"": [[""1590400935393648641"", ""1590320914960302081"", ""1590398912724017152""], [""1590400935393648641"", ""1590398912724017152"", ""KOnFkleRZlM""], [""1590400935393648641"", ""1590398912724017152"", ""KOnFkleRZlM""], [""1590400935393648641"", ""1590398912724017152"", ""FELPIDFfRLg"", ""MoNlUMFqUFY"", ""uWFRDGc7TUM"", ""KOnFkleRZlM""], [""1590398912724017152"", ""KOnFkleRZlM""]]}, ""Warnock defeated Walker by a 2.8% margin in the runoff and became the first African-American from Georgia elected to a full term in the U.S. Senate."": {""claims"": [""Warnock defeated Walker"", ""Warnock won in a runoff election""], ""grounded"": [true, true], ""video_ids"": [[""MoNlUMFqUFY""], [""MoNlUMFqUFY""]]}, ""Warnock's victory also secured an outright majority for Senate Democrats for the first time since 2015, with a net gain of one seat in the 2022 midterms."": {""claims"": [""Warnock won the election"", ""Warnock is a Democrat"", ""The election was part of the 2022 midterms"", ""Democrats had a net gain of one seat in the 2022 midterm elections""], ""grounded"": [true, true, true, true], ""video_ids"": [[""MoNlUMFqUFY""], [""1590400935393648641"", ""1590320914960302081"", ""1590398912724017152"", ""MoNlUMFqUFY"", ""uWFRDGc7TUM"", ""KOnFkleRZlM"", ""3B7VZCHKUWE""], [""1590400935393648641"", ""1590320914960302081"", ""1590398912724017152"", ""MoNlUMFqUFY"", ""uWFRDGc7TUM"", ""KOnFkleRZlM"", ""3B7VZCHKUWE""], [""1590320914960302081""]]}, ""It was the third-closest Senate election of the 2022 midterms after Nevada and Wisconsin."": {""claims"": [""The election was part of the 2022 midterms"", ""Nevada had a close Senate election"", ""Wisconsin had a close Senate election""], ""grounded"": [true, true, true], ""video_ids"": [[""1590320914960302081"", ""1590398912724017152"", ""MoNlUMFqUFY"", ""uWFRDGc7TUM"", ""KOnFkleRZlM"", ""3B7VZCHKUWE""], [""1590398912724017152""], [""1590320914960302081""]]}, ""This is the first time since 1990 that a Democratic senator from Georgia won re-election and the first time since 1974 that a Democrat won re-election to the Class 3 seat."": {""claims"": [""The Democratic senator from Georgia was the incumbent senator"", ""The Democratic senator from Georgia won re-election""], ""grounded"": [true, true], ""video_ids"": [[""1590400935393648641"", ""1590320914960302081"", ""1590398912724017152"", ""FELPIDFfRLg"", ""MoNlUMFqUFY"", ""uWFRDGc7TUM"", ""KOnFkleRZlM"", ""3B7VZCHKUWE""], [""MoNlUMFqUFY""]]}}}"
